{
  "schema_version": "planspec-8",
  "units": "m",
  "origin": {
    "x": 0,
    "y": 0
  },
  "nodes": [
    {
      "id": "a",
      "x": 0,
      "y": 0,
      "source": {
        "region_px": [
          0,
          0,
          10,
          10
        ],
        "confidence": 1,
        "classification": "measured"
      }
    },
    {
      "id": "b",
      "x": 4,
      "y": 0,
      "source": {
        "region_px": [
          40,
          0,
          50,
          10
        ],
        "confidence": 1,
        "classification": "measured"
      }
    },
    {
      "id": "c",
      "x": 4,
      "y": 3,
      "source": {
        "region_px": [
          40,
          30,
          50,
          40
        ],
        "confidence": 1,
        "classification": "measured"
      }
    },
    {
      "id": "d",
      "x": 0,
      "y": 3,
      "source": {
        "region_px": [
          0,
          30,
          10,
          40
        ],
        "confidence": 1,
        "classification": "measured"
      }
    }
  ],
  "lines": [
    {
      "id": "outline-a",
      "start": "a",
      "end": "b",
      "layer": "0",
      "source": {
        "region_px": [
          0,
          0,
          50,
          10
        ],
        "confidence": 1,
        "classification": "measured"
      }
    },
    {
      "id": "outline-b",
      "start": "b",
      "end": "c",
      "layer": "0",
      "source": {
        "region_px": [
          40,
          0,
          50,
          40
        ],
        "confidence": 1,
        "classification": "measured"
      }
    },
    {
      "id": "outline-c",
      "start": "c",
      "end": "d",
      "layer": "0",
      "source": {
        "region_px": [
          0,
          30,
          50,
          40
        ],
        "confidence": 1,
        "classification": "measured"
      }
    },
    {
      "id": "outline-d",
      "start": "d",
      "end": "a",
      "layer": "0",
      "source": {
        "region_px": [
          0,
          0,
          10,
          40
        ],
        "confidence": 1,
        "classification": "measured"
      }
    }
  ],
  "circles": [],
  "dimensions": [],
  "topology": {
    "contours": [
      {
        "id": "room-1",
        "line_ids": [
          "outline-a",
          "outline-b",
          "outline-c",
          "outline-d"
        ],
        "role": "room",
        "source": {
          "region_px": [
            0,
            0,
            50,
            40
          ],
          "confidence": 1,
          "classification": "measured"
        }
      }
    ]
  },
  "walls": [
    {
      "id": "wall-south",
      "start": "a",
      "end": "b",
      "thickness_m": 0.2,
      "layer": "0",
      "source": {
        "region_px": [
          0,
          0,
          50,
          10
        ],
        "confidence": 1,
        "classification": "measured"
      }
    }
  ],
  "openings": [
    {
      "id": "door-south",
      "wall_id": "wall-south",
      "offset_m": 1,
      "width_m": 0.9,
      "kind": "door",
      "source": {
        "region_px": [
          10,
          0,
          20,
          10
        ],
        "confidence": 1,
        "classification": "measured"
      },
      "swing": {
        "hinge": "start",
        "side": "left",
        "angle_deg": 90,
        "leaf_height_m": 2.1
      }
    }
  ],
  "joins": [],
  "dimension_bindings": [],
  "dimension_style": {
    "name": "OCS_WALL_READABLE",
    "text_height_m": 0.07,
    "arrow_size_m": 0.035,
    "gap_m": 0.015,
    "scale": 1,
    "measurement_factor": 1
  },
  "dimension_placements": [],
  "obstacles": [
    {
      "id": "furniture-a",
      "kind": "furniture",
      "min_x_m": 1.2,
      "min_y_m": 0.4,
      "max_x_m": 1.3,
      "max_y_m": 0.5,
      "base_z_m": 0,
      "height_m": 0.8,
      "source": {
        "region_px": [
          10,
          0,
          20,
          10
        ],
        "confidence": 1,
        "classification": "measured"
      }
    }
  ]
}
